index,case_id,classification,doc_id,quoteText,score,service,service_id,source,status
2000,286,bad,112.0,"This Service is provided by DeviantArt on an ""AS IS"" and ""AS AVAILABLE"" basis and DeviantArt reserves the right to modify, suspend or discontinue the Service, in its sole discretion, at any time and without notice.
<b>",20, DeviantArt,192,http://about.deviantart.com/policy/service/,approved
2001,287,bad,112.0,"DEVIANTART MAKES NO WARRANTY AS TO THE SECURITY, RELIABILITY, TIMELINESS, AND PERFORMANCE OF THIS SERVICE.",30, DeviantArt,192,http://about.deviantart.com/policy/service/,approved
2002,164,bad,111.0,"Where permitted by local data protection laws, we will disclose PII when required by law or under the good-faith belief that such disclosure is necessary in order to conform to applicable law, comply with subpoenas, court orders or legal process served on DeviantArt, to establish or exercise our legal rights or defend against legal claims, and to protect the property or interests of DeviantArt, its agents and employees, personal safety, or the public.
Under these circumstances, DeviantArt may be prohibited by law, court order or other legal process from providing notice of the disclosure, and DeviantArt reserves the right under those conditions to not provide notice in its sole discretion.</p>",50, DeviantArt,192,http://about.deviantart.com/policy/privacy/,approved
2003,280,neutral,112.0,<li>for any unlawful purposes;,10, DeviantArt,192,http://about.deviantart.com/policy/service/,approved
2004,161,good,112.0,"<p>In general, DeviantArt accepts returns on defective products or incorrect orders within thirty (30) days after receipt of your order.
Please contact DeviantArt at https://help.deviantart.com/contact/ and we will let you know whether you need to return the product(s) to us.",30, DeviantArt,192,http://about.deviantart.com/policy/service/,approved
2005,291,neutral,112.0,"You are responsible for all of Your Content you upload, download, and otherwise copy, distribute and display using the Service.",50, DeviantArt,192,http://about.deviantart.com/policy/service/,approved
2006,183,good,112.0,DeviantArt does not claim ownership rights in your works or other materials posted by you to DeviantArt (Your Content).,50, DeviantArt,192,http://about.deviantart.com/policy/service/,approved
2007,306,good,,,40, DeviantArt,192,https://about.deviantart.com/policy/privacy/,approved
2008,293,bad,112.0,"TO THE FULLEST EXTENT ALLOWED BY LAW, DEVIANTART SHALL NOT BE LIABLE FOR ANY DAMAGES OF ANY KIND ARISING FROM USE OF THE SERVICE, INCLUDING BUT NOT LIMITED TO DIRECT, INDIRECT, INCIDENTAL, CONSEQUENTIAL, SPECIAL, EXEMPLARY, OR PUNITIVE DAMAGES, EVEN IF DEVIANTART HAS BEEN ADVISED OF THE POSSIBILITY OF SUCH DAMAGES.",50, DeviantArt,192,http://about.deviantart.com/policy/service/,approved
2009,295,neutral,112.0,DeviantArt's failure to enforce any right or provision in these Terms shall not constitute a waiver of such right or provision.,10, DeviantArt,192,http://about.deviantart.com/policy/service/,approved
2010,336,bad,111.0,"We use your PII to help customize advertising and content available on the DeviantArt Sites, to send you service-related notices and promotional information about products and services that may be of interest to you and/or to conduct research for internal purposes.",50, DeviantArt,192,http://about.deviantart.com/policy/privacy/,approved
2011,315,neutral,112.0,"<li>to upload, post, or otherwise transmit any material that is obscene, offensive, blasphemous, pornographic,",15, DeviantArt,192,http://about.deviantart.com/policy/service/,approved
2012,283,neutral,112.0,"threatening, menacing, abusive, harmful, an invasion of privacy or publicity rights, defamatory, libelous, vulgar, illegal or otherwise objectionable;",20, DeviantArt,192,http://about.deviantart.com/policy/service/,approved
2013,329,neutral,112.0,"We reserve the right to amend these Terms from time to time in our sole discretion.
If you have registered as a member, we shall notify you of any material changes to these Terms (and the effective date of such changes) by sending an email to the address you have provided to DeviantArt for your account.
For all other users, we will post the revised terms on the Site.",50, DeviantArt,192,http://about.deviantart.com/policy/service/,approved
2014,307,bad,111.0,"Our Services include certain Social Media features and widgets, such as the ""Facebook Like"" button, the ""Share this"" button or other interactive mini-programs (""Social Media Features"").
These Social Media Features may collect information such as your IP address or which page you are visiting on our Sites, and may set a cookie to enable them to function properly",50, DeviantArt,192,http://about.deviantart.com/policy/privacy/,approved
2015,203,bad,112.0,"You agree that DeviantArt is and will not be liable to you for any modification, suspension or discontinuance of the Service.",40, DeviantArt,192,http://about.deviantart.com/policy/service/,approved
2016,163,neutral,112.0,"These Terms shall be governed by and construed in accordance with the laws of the State of California.
Any disputes arising under or in connection with these Terms shall be subject to the exclusive jurisdiction of the state and federal courts of the State of California.",0, DeviantArt,192,http://about.deviantart.com/policy/service/,approved
2017,243,bad,111.0,"In addition, should we, Wix or any of its affiliates undergo any change in control, including by means of merger, acquisition or purchase of substantially all of its assets, your PII may be shared with the parties involved in such event.",50, DeviantArt,192,http://about.deviantart.com/policy/privacy/,approved
2018,191,neutral,111.0,"We may share PII as well as aggregated information and non-identifying information that we collect with third party service providers whose services and solutions complement, facilitate and enhance our own.
These include hosting and server co-location services, communications and content delivery networks (CDNs), data and cyber security services, billing and payment processing services, fraud detection and prevention services, industry analysis, demographic profiling, web analytics, e-mail distribution and monitoring services, session recording and remote access services, performance measurement, data optimisation and marketing services, content providers, and our legal and financial advisors (collectively, ""<strong>Third Party Services</strong",10, DeviantArt,192,http://about.deviantart.com/policy/privacy/,approved
2019,140,good,111.0,"For all DeviantArt Users, if you wish to receive a copy, access and/or request us to make corrections to the PII that you have stored with us, or wish to request a list of what PII (if any) pertaining to you we disclosed to third parties for direct marketing purposes, feel free to send us an e-mail to help@deviantart.com, or mail your request to DeviantArt 7095 Holywood Blvd.
Los Angeles, CA, USA 90028.
We will make all reasonable efforts to honor your request promptly (unless we require further information from you in order to fulfil your request) subject to legal and other permissible considerations.</p>
<p>Note that when deleting your PII, you actually delete all your data, and will not be able to use our Service anymore",40, DeviantArt,192,http://about.deviantart.com/policy/privacy/,approved
2020,148,neutral,112.0,"You are responsible for safeguarding the password and you agree not to disclose your password to any third party.
You agree that you shall be solely responsible for any activities or actions under your password, whether or not you have authorized such activities or actions.",10, DeviantArt,192,http://about.deviantart.com/policy/service/,approved
2021,152,neutral,112.0,"To register as a member of the Service or purchase products, you must be 13 years or lawfully permitted to enter into and form contracts under applicable law.",15, DeviantArt,192,http://about.deviantart.com/policy/service/,approved
2022,294,neutral,112.0,"If a court should find that one or more provisions contained in these Terms is invalid, you agree that the remainder of the Terms shall be enforceable.",10, DeviantArt,192,http://about.deviantart.com/policy/service/,approved
2023,126,neutral,111.0,"p>
<p>Like many Internet sites, we, together with our marketing, analytics and technology partners, also use ""cookies"" to collect information.
A cookie is a small data file that we transfer to your computer and is stored on your hard drive when you access our Services.
When you visit our Services the cookie identifies your computer to us so that you do not have to re-register each time you visit.
This technology is used in order to maintain, provide and improve our Services on an ongoing basis, and in order to provide our visitors and users with a better experience.
We also use cookies to identify that you've logged in to the Services, to tell us how and when you interact with our Services, to monitor aggregate usage and web traffic routing on our Services, to return you to a persistent location of your choosing, and to customize and improve our Services and to measure the traffic to our Sites and the use of different features of the Services",10, DeviantArt,192,http://about.deviantart.com/policy/privacy/,approved
2024,311,good,1709.0,This site does not use any third party providers and does not share your Personal Information with anyone else.,50, devsoap,1734,https://devsoap.com/privacy,approved
2025,218,good,1709.0,"Our website does not use cookies or other tracking mechanisms.
We do not believe in tracking users in this way.",100, devsoap,1734,https://devsoap.com/privacy,approved
2026,120,neutral,1709.0,"This Privacy Policy<p>We may update our Privacy Policy from time to time.
Thus, we advise you to review this page periodically for any changes.",35, devsoap,1734,https://devsoap.com/privacy,approved
2027,139,bad,4496.0,"You grant to www.dhakatribune.com a worldwide, irrevocable, non-exclusive, royalty-free license to use, reproduce, adapt, publish, translate and distribute your user content in any existing or future media.",50, Dhaka Tribune,2896,https://www.dhakatribune.com/terms-and-conditions,approved
2028,238,neutral,4496.0,Your user content must not be illegal or unlawful,0, Dhaka Tribune,2896,https://www.dhakatribune.com/terms-and-conditions,approved
2029,293,bad,4496.0,"www.dhakatribune.com will not be liable to you (whether under the law of contract, the law of torts or otherwise) in relation to the contents of, or use of, or otherwise in connection with, this website:</p>
<ul>
<li>&nbsp;to the extent that the website is provided free-of-charge, for any direct loss;</li>
<li>for any indirect, special or consequential loss.
or &nbsp;&nbsp;</li>
<li>for any business losses, loss of revenue, income, profits or anticipated savings, loss of contracts or business relationships, loss of reputation or goodwill, or loss or corruption of information or &nbsp.
&nbsp.
data.</li>
</ul>
<p>These limitations of liability apply even if www.dhakatribune.com has been expressly advised of the potential loss.",50, Dhaka Tribune,2896,https://www.dhakatribune.com/terms-and-conditions,approved
2030,376,bad,4495.0,We collect several different types of information for various purposes to provide and improve our Service to you.</p>,70, Dhaka Tribune,2896,https://www.dhakatribune.com/privacy-policy,approved
2031,375,neutral,4495.0,"if you do not accept cookies, you may not be able to use some portions of our Service.",50, Dhaka Tribune,2896,https://www.dhakatribune.com/privacy-policy,approved
2032,323,bad,4495.0,"Tracking technologies also used are beacons, tags, and scripts to collect and track information and to improve and analyze our Service.",50, Dhaka Tribune,2896,https://www.dhakatribune.com/privacy-policy,approved
2033,145,bad,4496.0,"You hereby indemnify www.dhakatribune.com and undertake to keep www.dhakatribune.com indemnified against any losses, damages, costs, liabilities and expenses (including without limitation legal expenses and any amounts paid by www.dhakatribune.com to a third party in settlement of a claim or dispute on the advice of www.dhakatribune.com’s legal advisers) incurred or suffered by www.dhakatribune.com arising out of any breach by you of any provision of these terms and conditions, or arising out of any claim that you have breached any provision of these terms and conditions.",40, Dhaka Tribune,2896,https://www.dhakatribune.com/terms-and-conditions,approved
2034,152,neutral,4495.0,"Our Service does not address anyone under the age of 18 (“Children”).</p>
<p>We do not knowingly collect personally identifiable information from anyone under the age of 18.
If you are a parent or guardian and you are aware that your Children has provided us with Personal Data, please contact us.
If we become aware that we have collected Personal Data from children without verification of parental consent, we take steps to remove that information from our servers.",15, Dhaka Tribune,2896,https://www.dhakatribune.com/privacy-policy,approved
2035,331,neutral,979.0,"Last Updated: 26th January, 2021",50, Diasporg,172,https://diasp.org/terms,approved
2036,124,good,979.0,"
Whenever we make changes to these Terms, the changes are effective six (6) weeks after we post such revised Terms to our website (indicated by revising the date at the top of these Terms)",40, Diasporg,172,https://diasp.org/terms,approved
2037,146,bad,422.0,"you agree to defend, indemnify and hold harmless Dictionary (and any of its parents, subsidiaries, affiliates, employees, agents, third party content providers, or licensors, and their respective directors, officers, employees, and agents) from and against all claims, liability, and expenses, including attorneys’ fees and legal fees and costs, arising out of your use of the Services or your breach of any provision of this agreement",60, Dictionary.com,320,https://www.dictionary.com/e/terms/,approved
2038,233,bad,422.0,"We note that an optional browser setting known as Do Not Track allows you to express your preferences regarding tracking by advertisers and other third-parties.
However, we do not recognize or respond to browser-initiated DNT signals, as the Internet industry is currently still working toward defining exactly what DNT means, what it means to comply with DNT, and a common approach to responding to DNT.",60, Dictionary.com,320,https://www.dictionary.com/e/terms/,approved
2039,325,bad,422.0,"We use third party cookies for functionality, performance / analytics, advertising and social media purposes.",10, Dictionary.com,320,https://www.dictionary.com/e/terms/,approved
2040,336,bad,422.0,"Marketing: We may use your personal information to deliver relevant advertisements to you and measure the effectiveness of the advertising we serve to you.
It is in our legitimate interest to provide more relevant and interesting advertising messages and inform our marketing strategy.",50, Dictionary.com,320,https://www.dictionary.com/e/terms/,approved
2041,307,bad,422.0,"Social Media Cookies Third parties that make their applications available through/on our Sites may set their own cookies in order to track the performance of their applications or customize those applications for you.
For example, when you share an article using a social media sharing button on our Sites (e.g., Facebook, Twitter, or Instagram), the social network that has created the button will record that you have done this",50, Dictionary.com,320,https://www.dictionary.com/e/terms/,approved
2042,373,bad,422.0,"Mobile Device Location Information:</u> When you use one of our location-enabled services (for example, when you access Services from a mobile device), we may need to collect and process information about your specific GPS location (including the latitude, longitude or altitude of your mobile device) and the time the location information was recorded, and we may use that information to customize the Services with location-based information, advertising, and features.",75, Dictionary.com,320,https://www.dictionary.com/e/terms/,approved
2043,223,good,422.0,"Promotional Communications.
You can opt-out of receiving certain promotional communications (e-mails and push notifications) from us at any time by (i) for e-mails, following the instructions as provided in e-mails to click on the unsubscribe link.
and (ii) for push notifications or in-app messages, adjusting the permissions in your mobile device",10, Dictionary.com,320,https://www.dictionary.com/e/terms/,approved
2044,243,bad,422.0,"We may transfer your information to a third party if we or any of our affiliates are involved in a corporate restructuring (e.g., a sale, merger, or other transfer of assets).",50, Dictionary.com,320,https://www.dictionary.com/e/terms/,approved
2045,323,bad,422.0,"cookies, web beacons, pixel tags, clear gifs, and other similar files or technologies may be used to collect and store the information automatically collected about your computer, device, and Service usage",50, Dictionary.com,320,https://www.dictionary.com/e/terms/,approved
2046,216,bad,422.0,We may use automated decision-making to deliver tailored advertisements based on your personal information.,30, Dictionary.com,320,https://www.dictionary.com/e/terms/,approved
2047,152,neutral,422.0,"IF YOU ARE NOT AT LEAST 16 YEARS OLD, DO NOT USE THE SERVICES",15, Dictionary.com,320,https://www.dictionary.com/e/terms/,approved
2048,286,bad,1407.0,"REKLAMSTORE USERS UNDERSTAND AND AGREE THAT THIS WEBSITE AND ITS CONTENT, MATERIALS, AND PRODCUTS ARE PRESENTED TO YOU AS IS AND HOWEVER IT IS AVAILABLE.
WHEN YOU USE REKLAMSTORE IT IS AT YOUR OWN RISK.",20, Digital Advertising Platform | ReklamStore,1590,https://www.reklamstore.com/terms-and-conditions,approved
2049,331,neutral,1409.0,"Last Update: May 2018</strong>
</p>",50, Digital Advertising Platform | ReklamStore,1590,https://www.reklamstore.com/cookie-policy/,approved
2050,130,bad,333.0,"<p>If You cease using the Service, You confirm that We are entitled to continue using Your user-generated content and may continue to display Your username along with Your content pursuant to the rights granted above.</p>",50, Discogs,603,https://support.discogs.com/hc/en-us/articles/360009334333,approved
2051,136,neutral,333.0,"You grant a non-exclusive, non-revocable, transferable right to Us to use Your user-generated content, unrestricted in time and territory, for the purpose of rendering the Service.</p",50, Discogs,603,https://support.discogs.com/hc/en-us/articles/360001134454,approved
2052,237,neutral,333.0,"You agree: (1) to comply with U.S.
and applicable international law regarding the transmission of technical or other data exported from Your country through the Service",0, Discogs,603,https://support.discogs.com/hc/en-us/articles/360009334333,approved
2053,146,bad,333.0,"INDEMNITY
<p>You agree to indemnify and hold Us, and Our subsidiaries, affiliates, officers, agents, co-branders or other partners, and employees, harmless from any alleged claim or demand, including reasonable attorney fees, made by any third party due to or arising out of Your use of the Service, Your connection to the Service, Your violation of the TOS, or Your violation of any rights of another, whether You are a registered user or not.
You are solely responsible for Your actions when using the Service, including, but not limited to, costs incurred for Internet access.</p",60, Discogs,603,https://support.discogs.com/hc/en-us/articles/360001134454,approved
2054,239,bad,333.0,"<p>We may review user account activity, such as private messages, account details and order pages, upon receipt of complaints from other users.",70, Discogs,603,https://support.discogs.com/hc/en-us/articles/360009334333,approved
2055,143,neutral,333.0,"This license does not include any resale or commercial use of the Service, including its contents.
any collection and use of any product listings, descriptions, or prices.
any derivative use of the Service, including its contents.
any downloading or copying of account information for the benefit of another merchant.
or any use of data mining, robots, or similar data gathering and extraction tools.
The Service, including the content therein, may not be reproduced, duplicated, copied, sold, resold, visited, or otherwise exploited for any commercial purpose without Our express written consent.</p>
<p>",25, Discogs,603,https://support.discogs.com/hc/en-us/articles/360009334333,approved
2056,201,bad,333.0,"TERMINATION
<p>You agree that We, in Our sole discretion, may terminate Your account (if applicable), and remove and discard any of Your content within the Service, for any reason, including and without limitation, the lack of use, or if We find that You have violated or acted inconsistently with the letter or spirit of the TOS.
You agree that any termination of Your access to the Service under any provision of this TOS may be effected without prior notice, and acknowledge and agree that We may immediately deactivate or delete Your account and any or all related information and files.
We reserve the right to bar any further access to such files or the Service.
You agree that We shall not be liable to You or any third party for any termination of Your access to the Service.
Any advanced accounts that are terminated will not be refunded.</p>
<p>Should You object to any terms and conditions of the TOS or any subsequent modifications thereto or become dissatisfied with the Service in any way, Your only recourse is to immediately discontinue use of the Service.</p>
<p>Upon termination of the Service, Your right to use the Service immediately ceases.
You shall have no right and We will have no obligation thereafter to forward any unread or unsent messages to You or any third party.",60, Discogs,603,https://support.discogs.com/hc/en-us/articles/360009334333,approved
2057,285,bad,333.0,You shall not interfere with another person’s use and enjoyment of the Service or another entity's use and enjoyment of similar services.</p>,25, Discogs,603,https://support.discogs.com/hc/en-us/articles/360001134454,approved
2058,284,neutral,333.0,Attempts to gain unauthorized access to other computer systems are prohibited.,20, Discogs,603,https://support.discogs.com/hc/en-us/articles/360001134454,approved
2059,286,bad,333.0,"DISCLAIMER OF WARRANTIES
<p>YOU EXPRESSLY UNDERSTAND AND AGREE THAT:</p>
<p>(a) YOUR USE OF THE SERVICE IS AT YOUR SOLE RISK.
THE SERVICE ARE PROVIDED ON AN ""AS IS"" AND ""AS AVAILABLE"" BASIS.
WE EXPRESSLY DISCLAIM ALL WARRANTIES OF ANY KIND, WHETHER EXPRESS OR IMPLIED, INCLUDING, BUT NOT LIMITED TO THE IMPLIED WARRANTIES OF MERCHANTABILITY, FITNESS FOR A PARTICULAR PURPOSE AND NON-INFRINGEMENT",20, Discogs,603,https://support.discogs.com/hc/en-us/articles/360001134454,approved
2060,287,bad,333.0,"(ii) THE SERVICE WILL BE UNINTERRUPTED, TIMELY, SECURE, OR ERROR-FREE,",30, Discogs,603,https://support.discogs.com/hc/en-us/articles/360001134454,approved
2061,280,neutral,333.0,(2) not to use the Service for illegal purposes.,10, Discogs,603,https://support.discogs.com/hc/en-us/articles/360001134454,approved
2062,279,neutral,333.0,"LINKS
<p>We or others related to the Service may provide links to other websites or resources.
Because We have no control over such websites and resources, You acknowledge and agree that We are not responsible for the availability of such external websites or resources, and do not endorse and are not responsible or liable for any content, advertising, products, or other materials on or available from such websites or resources.",50, Discogs,603,https://support.discogs.com/hc/en-us/articles/360009334333,approved
2063,289,bad,333.0,(V) ANY ERRORS IN THE SOFTWARE WILL BE CORRECTED.,50, Discogs,603,https://support.discogs.com/hc/en-us/articles/360001134454,approved
2064,291,neutral,333.0,<p>(c) ANY MATERIAL DOWNLOADED OR OTHERWISE OBTAINED THROUGH THE USE OF THE SERVICE IS DONE AT YOUR OWN DISCRETION AND RISK AND THAT YOU WILL BE SOLELY RESPONSIBLE FOR ANY DAMAGE TO YOUR COMPUTER SYSTEM OR LOSS OF DATA OR OTHER LIABILITY THAT RESULTS FROM THE DOWNLOAD OF ANY SUCH MATERIAL.,50, Discogs,603,https://support.discogs.com/hc/en-us/articles/360001134454,approved
2065,292,neutral,333.0,"(e) WE DO NOT PROMOTE OR CONDONE ANY IDEAS OR MESSAGES CONTAINED IN THE USER-GENERATED CONTENT AVAILABLE THROUGH THE SERVICE.</p>
",35, Discogs,603,https://support.discogs.com/hc/en-us/articles/360009334333,approved
2066,293,bad,333.0,"YOU EXPRESSLY UNDERSTAND AND AGREE THAT WE SHALL NOT BE LIABLE FOR ANY DIRECT, INDIRECT, INCIDENTAL, SPECIAL, CONSEQUENTIAL OR EXEMPLARY DAMAGES, INCLUDING BUT NOT LIMITED TO, DAMAGES FOR LOSS OF PROFITS, GOODWILL, USE, DATA OR OTHER INTANGIBLE LOSSES (EVEN IF WE HAVE BEEN ADVISED OF THE POSSIBILITY OF SUCH DAMAGES), RESULTING FROM: (i) THE USE OR THE INABILITY TO USE THE SERVICE.
(ii) THE COST OF PROCUREMENT OF SUBSTITUTE GOODS AND SERVICES RESULTING FROM ANY GOODS, DATA, INFORMATION OR SERVICES PURCHASED OR OBTAINED OR MESSAGES RECEIVED OR TRANSACTIONS ENTERED INTO THROUGH OR FROM THE SERVICE.
(iii) UNAUTHORIZED ACCESS TO OR ALTERATION OF YOUR TRANSMISSIONS OR DATA.
(iv) STATEMENTS OR CONDUCT OF ANY THIRD PARTY ON THE SERVICE.
OR (v) ANY OTHER MATTER RELATING TO THE SERVICE.</p>
",50, Discogs,603,https://support.discogs.com/hc/en-us/articles/360009334333,approved
2067,295,neutral,333.0,Our failure to exercise and enforce any right or provision of the TOS shall not constitute a waiver of such right or provision.,10, Discogs,603,https://support.discogs.com/hc/en-us/articles/360009334333,approved
2068,283,neutral,333.0,"You agree not to transmit through the Service any unlawful, harassing, libelous, abusive, threatening, or harmful content or language of any kind or nature.",20, Discogs,603,https://support.discogs.com/hc/en-us/articles/360009334333,approved
