index,case_id,classification,doc_id,quoteText,score,service,service_id,source,status
2452,195,good,448.0,"You have the following rights with respect to us regarding the personal data relating to you:</p>
<ul>
<li>Right to information</li>
<li>Right to correction or deletion",50, Ecosia,591,https://info.ecosia.org/privacy,approved
2453,208,bad,448.0,"You can also register via your accounts with the third-party providers Facebook, Twitter and Google.
When you register via the login details of a third-party provider, the provider will also process your personal data.
however, we will not have access to this information.
Information collected by the commenting function is made available to us via Disqus.",50, Ecosia,591,https://info.ecosia.org/privacy,approved
2454,193,good,448.0,"We do not, and never will, share or sell any data we collect ourselves with any third party.",25, Ecosia,591,https://info.ecosia.org/privacy,approved
2455,374,good,448.0,We do not store any personal information in the cookie.,50, Ecosia,591,https://info.ecosia.org/privacy,approved
2456,299,neutral,448.0,For more information on how Bing handles your data see their privacy policy.</p>,10, Ecosia,591,https://info.ecosia.org/privacy,approved
2457,128,bad,448.0,Ecosia allows third-party providers to set cookies in order to check the success of Ecosia advertising campaigns.</p>,70, Ecosia,591,https://info.ecosia.org/privacy,approved
2458,304,bad,448.0,The anonymised data are saved for as long as is necessary,40, Ecosia,591,https://info.ecosia.org/privacy,approved
2459,221,good,448.0,After 7 days we remove all personal information (like the IP address) from the search data we collect ourselves.,35, Ecosia,591,https://info.ecosia.org/privacy,approved
2460,320,good,3366.0,<p>To access certain features of the Website you have to register by entering your email and choosing a password as part of our security procedures.,50, Ecosia,591,https://docs.google.com/a/ecosia.org/document/d/1x31-MsVMcl17dK3k80IRPxIj5ZKQEHZPXRhU01H_Xfw/pub,approved
2461,325,bad,448.0,"<p>Ecosia does use third party tools on non-search pages where absolutely necessary to help us understand and tune our marketing campaigns.
For example, we may run an ad campaign on a social media site that requires us to share some data about user activity in order to help us understand how effective that campaign is.",10, Ecosia,591,https://info.ecosia.org/privacy,approved
2462,331,neutral,448.0,Data protection declaration version date,50, Ecosia,591,https://info.ecosia.org/privacy,approved
2463,326,bad,448.0,Your Bing Client ID (if enabled),50, Ecosia,591,https://info.ecosia.org/privacy,approved
2464,329,neutral,3366.0,"Changes to the Terms of Service and the Website<p>Ecosia is a work in progress, meaning that a lot will change in the near future.
We reserve the right to update the Website and these Terms of Service from time to time, at our discretion.
We will make sure to announce any major change in a prominent way.",50, Ecosia,591,https://docs.google.com/a/ecosia.org/document/d/1x31-MsVMcl17dK3k80IRPxIj5ZKQEHZPXRhU01H_Xfw/pub,approved
2465,395,blocker,448.0,We also save the searches we receive to filter spam.,50, Ecosia,591,https://info.ecosia.org/privacy,approved
2466,387,bad,448.0,In some cases which way you have found out about Ecosia</li>,50, Ecosia,591,https://info.ecosia.org/privacy,approved
2467,375,neutral,448.0,Please note that you may not be able to use all functions of this website within the full scope if you deactivate cookies for our website.,50, Ecosia,591,https://info.ecosia.org/privacy,approved
2468,403,bad,3366.0,Your continued use of the Website following the publishing of updated Terms of Service means that you accept and agree to the changes.,50, Ecosia,591,https://docs.google.com/a/ecosia.org/document/d/1x31-MsVMcl17dK3k80IRPxIj5ZKQEHZPXRhU01H_Xfw/pub,approved
2469,228,good,448.0,"In the case of use of the website for purely informational purposes, if you do not – for instance, using our search function – provide us with information in any other way, we gather only the personal data which your browser transmits to our server.
If you wish to view our website, we gather the following data, which we technically require in order to show you our website and to guarantee stability and security.
The legal basis for the temporary storage of the data is Art.
6 Para.
1 lit.
f of the General Data Protection Regulation.</p>
<ul>
<li>IP address</li>
<li>Date and time of enquiry</li>
<li>Difference between time zone and Greenwich Mean Time (GMT)</li>
<li>Content of the request (specific webpage)</li>
<li>Access status / HTTP status code</li>
<li>Respectively transferred data quantity</li>
<li>Website from which the request comes</li>
<li>Browser</li>
<li>Operating system and its surface</li>
<li>Language and version of the browser software.</li>
</ul>
<p>The data are saved in the logfiles of our system.
This data can never be connected to other personal data of our users.
The data are deleted once they are no longer required to achieve the purpose of your gathering.
In the event that the data are saved in log files, this occurs at the most seven days later.</p>
<p>It is possible to save the data for longer than this.
In this case, the users’ IP addresses are deleted or anonymised so that they can no longer be associated with the visiting client.</p>
<p>In addition, while you are using our website, cookies are saved on your computer.
See below and section 4 in this regard.</p>
<p>We gather anonymous data in order to identify and gather errors and problems in Ecosia products and services.
These data include data in connection with program crashes.
We use several third-party providers for the gathering of error logs.
During the use of the Ecosia’s website, various pieces of personal data that are necessary for the performance are saved on the technical infrastructure of the third-party supplier a limited period of time in encrypted form.",30, Ecosia,591,https://info.ecosia.org/privacy,approved
2470,373,bad,448.0,We use the locational data in order to give you a better Ecosia experience or to show more relevant search results or advertising to you.,75, Ecosia,591,https://info.ecosia.org/privacy,approved
2471,241,good,3366.0,"These Terms of Service and any dispute or claim arising out of, or related to them, shall be governed by and construed in accordance with German laws without giving effect to any choice or conflict of law provision or rule.</p>",50, Ecosia,591,https://docs.google.com/a/ecosia.org/document/d/1x31-MsVMcl17dK3k80IRPxIj5ZKQEHZPXRhU01H_Xfw/pub,approved
2472,188,bad,448.0,"<p>We will never share your searches with anyone except services that are directly involved in answering your search request, like Bing.",35, Ecosia,591,https://info.ecosia.org/privacy,approved
2473,187,bad,448.0,"Ecosia’s servers are located around the world in order to provide a fast response no matter where you are.
However, when you perform a search on Ecosia, your request will generally be routed to the server that is geographically nearest to you.
That means, for example, if you are located in Germany your search traffic will remain within Germany and will fall under strict German privacy regulations.",25, Ecosia,591,https://info.ecosia.org/privacy,approved
2474,383,good,448.0,"<p>If you have ""Do Not Track"" enabled in your browser settings we do not collect any analytics data.",30, Ecosia,591,https://info.ecosia.org/privacy,approved
2475,146,bad,2638.0,"You agree to defend, hold harmless, and indemnify edX and the edX Participants, and their respective subsidiaries, affiliates, officers, faculty, students, fellows, governing board members, agents and employees from and against any third-party claims, actions, or demands arising out of, resulting from or in any way related to your use of the edX Site, including any liability or expense arising from any and all claims, losses, damages (actual and consequential), suits, judgments, litigation costs, and attorneys' fees, of every kind and nature.",60, edX,632,https://www.edx.org/edx-terms-service,approved
2476,229,neutral,2638.0,"If you are a registered user, you will not share your password or let anyone else access or compromise your account.</p>",10, edX,632,https://www.edx.org/edx-terms-service,approved
2477,214,bad,2638.0,"In order to create a user account, you must provide your full name, an email address, your country or region of residence, a public username, and a user password.",20, edX,632,https://www.edx.org/edx-terms-service,approved
2478,127,bad,2637.0,"Some of the third parties used by edX or a Member for Cookies and Tracking Technologies offer the ability to opt-out from their tracking by following processes described on their websites.
A list of some such third parties is maintained and available at the edX learner Help Center and includes, for some, links to applicable opt-out processes.
Neither edX nor any Member is responsible for the effectiveness of any third-party opt-out options.</li>",5, edX,632,https://www.edx.org/edx-privacy-policy,approved
2479,195,good,2637.0,"To request deletion of your edX account and Personal Information, you should click the button labeled “Delete my account” in your edX account settings.",50, edX,632,https://www.edx.org/edx-privacy-policy,approved
2480,198,neutral,2638.0,Any version of these TOS in a language other than English is provided for convenience and you understand and agree that the English language version will control if there is any conflict.</p>,0, edX,632,https://www.edx.org/edx-terms-service,approved
2481,286,bad,2638.0,"THE EDX SITE AND ANY INFORMATION, CONTENT OR SERVICES MADE AVAILABLE ON OR THROUGH THE EDX SITE ARE PROVIDED ""AS IS"" AND ""AS AVAILABLE"" WITHOUT WARRANTY OF ANY KIND (EXPRESS, IMPLIED OR OTHERWISE), INCLUDING, WITHOUT LIMITATION, ANY IMPLIED WARRANTIES OF MERCHANTABILITY, FITNESS FOR A PARTICULAR PURPOSE, AND NON-INFRINGEMENT, EXCEPT INSOFAR AS ANY SUCH IMPLIED WARRANTIES MAY NOT BE DISCLAIMED UNDER APPLICABLE LAW.</strong>",20, edX,632,https://www.edx.org/edx-terms-service,approved
2482,287,bad,2638.0,"DO NOT WARRANT THAT THE EDX SITE WILL OPERATE IN AN UNINTERRUPTED OR ERROR-FREE MANNER, THAT THE EDX SITE IS FREE OF VIRUSES OR OTHER HARMFUL COMPONENTS,",30, edX,632,https://www.edx.org/edx-terms-service,approved
2483,279,neutral,2638.0,"The edX Site and individual courses may be integrated with third-party services or include hyperlinks to websites maintained or controlled by third parties.
edX and the edX Participants are not responsible for and do not routinely screen, approve, review or endorse the contents of or use of any of the products or services that may be offered by such third parties.",50, edX,632,https://www.edx.org/edx-terms-service,approved
2484,207,neutral,2637.0,"if you choose to make a purchase on the edX Site, for example a Verified Certificate, you will be directed to edX’s third-party payment processor and edX’s third-party ID verification service provider.",0, edX,632,https://www.edx.org/edx-privacy-policy,approved
2485,210,good,2637.0,"EdX requires third parties to: (1) abide by this Privacy Policy and applicable law.
(2) handle Personal Information in a confidential manner and maintain adequate security.
and (3) use Personal Information only as needed to fulfill the relevant purpose(s).",20, edX,632,https://www.edx.org/edx-privacy-policy,approved
2486,288,bad,2638.0,"NO WARRANTY ABOUT THE ACCURACY, COMPLETENESS, TIMELINESS, OR QUALITY OF THE EDX SITE OR ANY COURSES OR CONTENT, OR THAT ANY PARTICULAR COURSES OR CONTENT WILL CONTINUE TO BE MADE AVAILABLE.",10, edX,632,https://www.edx.org/edx-terms-service,approved
2487,291,neutral,2638.0,"USE OF THE EDX SITE, AND THE CONTENT AND SERVICES OBTAINED FROM OR THROUGH THE EDX SITE, IS AT YOUR OWN RISK.
YOUR ACCESS TO OR DOWNLOAD OF INFORMATION, MATERIALS, OR DATA THROUGH THE EDX SITE OR ANY REFERENCE SITES IS AT YOUR OWN DISCRETION AND RISK, AND YOU WILL BE SOLELY RESPONSIBLE FOR ANY DAMAGE TO YOUR PROPERTY (INCLUDING YOUR COMPUTER SYSTEM) OR LOSS OF DATA THAT RESULTS FROM THE DOWNLOAD OR USE OF SUCH MATERIAL OR DATA, UNLESS OTHERWISE EXPRESSLY PROVIDED FOR IN THE PRIVACY POLICY.",50, edX,632,https://www.edx.org/edx-terms-service,approved
2488,296,good,2637.0,"Members do not receive your Personal Information unless and until you enroll in a course.
If you enroll in a course, the Member that offers the course will receive Personal Information from your edX account profile plus the information that edX collects about your activity and performance in the course in which you enrolled.",80, edX,632,https://www.edx.org/edx-privacy-policy,approved
2489,297,good,2637.0,"EdX directly collects information when you:</p>
<ul>
<li>sign up for an edX user account and create an edX user profile;</li>
<li>enroll and participate in online courses;</li>
<li>purchase a product or service (for example, Verified Certificates);</li>
<li>send email messages to edX (including messages to learner support);</li>
<li>participate in user surveys.
and</li>
<li>participate in public forums, webinars, and other interactive experiences on the edX Site.</li>
</ul>
<p>EdX also indirectly collects usage information about your visit to the edX Site, as explained in the section below titled Cookies and Tracking Technologies.",50, edX,632,https://www.edx.org/edx-privacy-policy,approved
2490,299,neutral,2637.0,EdX is solely and independently responsible for its own privacy practices.,10, edX,632,https://www.edx.org/edx-privacy-policy,approved
2491,301,good,2637.0,This Privacy Policy will be reviewed and updated from time to time.,30, edX,632,https://www.edx.org/edx-privacy-policy,approved
2492,292,neutral,2638.0,"Neither edX nor any of the edX Participants endorse any User Postings or any opinion, recommendation or advice expressed therein.",35, edX,632,https://www.edx.org/edx-terms-service,approved
2493,293,bad,2638.0,"TO THE FULLEST EXTENT PERMITTED BY APPLICABLE LAW, YOU AGREE THAT NEITHER EDX NOR ANY OF THE EDX PARTICIPANTS WILL BE LIABLE TO YOU FOR ANY LOSS OR DAMAGES, EITHER ACTUAL OR CONSEQUENTIAL, ARISING OUT OF OR RELATING TO THESE TERMS OF SERVICE, OR YOUR (OR ANY THIRD PARTY'S) USE OF OR INABILITY TO USE THE EDX SITE, OR YOUR PLACEMENT OF CONTENT ON THE EDX SITE, OR YOUR RELIANCE UPON INFORMATION OBTAINED FROM OR THROUGH THE EDX SITE, WHETHER YOUR CLAIM IS BASED IN CONTRACT, TORT, STATUTORY OR OTHER LAW.</strong>
</p>
<p>
<strong>IN PARTICULAR, TO THE FULLEST EXTENT PERMITTED BY APPLICABLE LAW, NEITHER EDX NOR ANY OF THE EDX PARTICIPANTS WILL HAVE ANY LIABILITY FOR ANY CONSEQUENTIAL, INDIRECT, PUNITIVE, SPECIAL, EXEMPLARY, OR INCIDENTAL DAMAGES, WHETHER FORESEEABLE OR UNFORESEEABLE AND WHETHER OR NOT EDX OR ANY OF THE EDX PARTICIPANTS HAS BEEN NEGLIGENT OR OTHERWISE AT FAULT (INCLUDING, BUT NOT LIMITED TO, CLAIMS FOR DEFAMATION, ERRORS, LOSS OF PROFITS, LOSS OF DATA, OR INTERRUPTION IN AVAILABILITY OF DATA).",50, edX,632,https://www.edx.org/edx-terms-service,approved
2494,295,neutral,2638.0,The failure of edX to exercise or enforce any right or provision of the Agreements shall not constitute a waiver of such right or provision.,10, edX,632,https://www.edx.org/edx-terms-service,approved
2495,304,bad,2637.0,"These archives will be used to produce encrypted research data packages for Members, and each such Member may also keep and use course data for scientific research.",40, edX,632,https://www.edx.org/edx-privacy-policy,approved
2496,217,bad,2637.0,"edX may track and collect information from emails that edX sends to you, for example whether you opened the email or clicked on any links from the email.",5, edX,632,https://www.edx.org/edx-privacy-policy,approved
2497,331,neutral,2638.0,"Effective Date:<p>October 28, 2019",50, edX,632,https://www.edx.org/edx-terms-service,approved
2498,336,bad,2638.0,"Our goal is to provide current and future visitors to the edX Site with the best possible educational experience.
To further this goal, we sometimes present different users with different versions of course materials and software.
We do this to personalize the experience to the individual learner (to assess the learner’s level of ability and learning style, and present materials best suited to the learner), to improve our understanding of the learning process, and to evaluate and improve the effectiveness of our course materials, payment models, platform features, and offerings.",50, edX,632,https://www.edx.org/edx-terms-service,approved
2499,315,neutral,2638.0,"Profane, pornographic, obscene, indecent or unlawful content",15, edX,632,https://www.edx.org/edx-terms-service,approved
2500,283,neutral,2638.0,"Content that defames, harasses or threatens others",20, edX,632,https://www.edx.org/edx-terms-service,approved
2501,307,bad,2637.0,how you interact with edX’s social media,50, edX,632,https://www.edx.org/edx-privacy-policy,approved
2502,382,bad,2637.0,EdX also partners with third parties to help us track and understand your activity on the edX Site,50, edX,632,https://www.edx.org/edx-privacy-policy,approved
2503,391,good,2637.0,"If edX learns of a security breach involving its copy of your Personal Information, edX may attempt to notify you electronically so that you may take appropriate protective steps.",30, edX,632,https://www.edx.org/edx-privacy-policy,approved
2504,209,good,2637.0,"In some cases, the edX Site and individual courses are integrated with third-party services or contain links to websites published by third parties, including other content providers as well as service providers.
These third parties are responsible for their own privacy practices, so you should pay attention anytime you are redirected to a third-party website and be sure to review its privacy policy.</li>",30, edX,632,https://www.edx.org/edx-privacy-policy,approved
2505,387,bad,2637.0,how you find or may be referred to the edX Site,50, edX,632,https://www.edx.org/edx-privacy-policy,approved
2506,375,neutral,2637.0,"If you reject edX’s Cookies, many functions and conveniences of the edX Site may not work properly.</li>",50, edX,632,https://www.edx.org/edx-privacy-policy,approved
2507,121,bad,2638.0,"<p>edX reserves the right to modify these TOS at any time without advance notice.
Any changes to these TOS will be effective immediately upon posting on this page, with an updated effective date.",70, edX,632,https://www.edx.org/edx-terms-service,approved
2508,202,blocker,2638.0,"However, edX reserves the right to review User Postings and to exercise its sole discretion to edit or remove, in whole or in part, any User Posting at any time and for any reason, or to allow the edX Participants to do so.",50, edX,632,https://www.edx.org/edx-terms-service,approved
2509,163,neutral,2638.0,"You agree that the Agreements and any claim or dispute arising out of or relating to the Agreements or any content or service obtained from or through the edX Site will be governed by the laws of the Commonwealth of Massachusetts, excluding its conflicts of law provisions.
You agree that all such claims and disputes will be heard and resolved exclusively in the federal or state courts located in and serving Cambridge, Massachusetts, U.S.A.",0, edX,632,https://www.edx.org/edx-terms-service,approved
2510,242,bad,2637.0,"If you are in the European Union, Switzerland, or other regions with laws governing data collection and use, you acknowledge that edX and each Member may transfer, process and store your personal information in the United States and other countries, the privacy laws of which may be considered less strict than those of your region.</p>",50, edX,632,https://www.edx.org/edx-privacy-policy,approved
2511,215,good,2638.0,You agree not to misrepresent or attempt to misrepresent your identity while using the edX Site (although you are welcome and encouraged to use an anonymous username in the forums and to act in a manner that keeps your identity concealed).,20, edX,632,https://www.edx.org/edx-terms-service,approved
2512,333,bad,2637.0,"EdX and each applicable Member cannot always delete records of past interactions and transactions.
For example, records relating to previous purchases on the edX Site must be retained for financial reporting, audit, and compliance reasons.</li>
<li>EdX and each Member will retain and use Personal Information as necessary to comply with its legal obligations, resolve disputes, enforce its agreements, and as otherwise permitted by applicable law.",70, edX,632,https://www.edx.org/edx-privacy-policy,approved
2513,232,good,2637.0,You can manage your Personal Information through learner features on the edX Site and requests to the edX learner support team.,10, edX,632,https://www.edx.org/edx-privacy-policy,approved
2514,188,bad,2637.0,"EdX and Members share information, including Personal Information, with third parties for the following purposes",35, edX,632,https://www.edx.org/edx-privacy-policy,approved
2515,187,bad,2637.0,"In each case, information may be stored in the United States and in other countries where edX or a Member operates, and in countries where edX and each Member’s respective service providers operate.",25, edX,632,https://www.edx.org/edx-privacy-policy,approved
2516,290,bad,2638.0,THAT THE COURSES OR CONTENT PROVIDED WILL MEET YOUR NEEDS OR EXPECTATIONS.,0, edX,632,https://www.edx.org/edx-terms-service,approved
2517,126,neutral,2637.0,"EdX and Members use “first-party” cookies, which means cookies served by edX or an individual Member",10, edX,632,https://www.edx.org/edx-privacy-policy,approved
2518,174,blocker,2637.0,"Exceptions:</b>
</p>
<ul>
<li>Deletion will not apply to historical activity logs or archives unless and until these logs and data naturally ""age-off"" the edX system.</li",30, edX,632,https://www.edx.org/edx-privacy-policy,approved
2519,170,good,2638.0,"If you no longer desire to participate in the edX Site, you may terminate your participation at any time.",15, edX,632,https://www.edx.org/edx-terms-service,approved
2520,143,neutral,3900.0,"<br>ekşi'de yer alan hizmetler ve içeriklerden şahsi kullanımınız için faydalanmanız gerekmektedir.
ekşi tarafından sunulan hizmetlerin ve içeriğin ekşi teknoloji’den yazılı izin alınmadığı müddetçe ticari amaçla kullanılması yasaktır.",25, Eksi Sozluk,2681,https://eksisozluk.com/entry/19784395,approved
2521,127,bad,3898.0,"<br>ekşi’de yer alan 3.
şahısların çerezlerinden eğer imkan sunuyorlarsa ilgili 3.
şahsın internet sitesini ziyaret ederek vazgeçebilirsiniz.
<",5, Eksi Sozluk,2681,https://eksisozluk.com/entry/65310835,approved
2522,201,bad,3900.0,"<br>ekşi teknoloji, gerekli gördüğü takdirde belli kişilerin, kurumların, ip numaralarının veya ip bloklarının ekşi sözlük'e erişimini geçici veya kalıcı olarak durdurma hakkını saklı tutar.<br>",60, Eksi Sozluk,2681,https://eksisozluk.com/entry/19784395,approved
2523,195,good,3899.0,"<br>kvkk’nın 11.
maddesi kapsamında eksiteknoloji@hs01.kep.tr adresine kayıtlı elektronik postayla (kep) başvurarak kişisel verilerinizin işlenip işlenmediğini öğrenme, işlenmişse buna ilişkin bilgi talep etme, işlenme amacını ve bunların amacına uygun kullanılıp kullanılmadığını öğrenme, yurt içinde veya yurt dışında kişisel verilerin aktarıldığı üçüncü kişileri bilme, kişisel verilerin eksik veya yanlış işlenmiş olması hâlinde bunların düzeltilmesini isteme, kvkk’nın 7.
maddesinde öngörülen şartlar çerçevesinde kişisel verilerin silinmesini veya yok edilmesini isteme, düzeltme, silinme ve yok etme işlemlerinin, kişisel verilerin aktarıldığı üçüncü kişilere bildirilmesini isteme, işlenen verilerin münhasıran otomatik sistemler vasıtasıyla analiz edilmesi suretiyle kişinin kendisi aleyhine bir sonucun ortaya çıkmasına itiraz etme, kişisel verilerin kanuna aykırı olarak işlenmesi sebebiyle zarara uğraması hâlinde zararın giderilmesini talep etme haklarına sahipsiniz.<br>",50, Eksi Sozluk,2681,https://eksisozluk.com/entry/66470645,approved
2524,279,neutral,3900.0,"ekşi'de yer alan bağlantılara/yönlendirmelere (link) ilişkin hiçbir sorumluluğumuz bulunmamaktadır.
ekşi, bağlantı ve yönlendirmelerin içeriğini kontrol etmediği gibi, içeriğin doğruluğu, yönlendirilen adreste virüs, trojan, phishing ve benzeri zararlı bir unsur olmadığı veya yönlendirilen sitenin hukuka uygun olduğu gibi veya benzeri hiçbir bir garanti vermemektedir.<br>",50, Eksi Sozluk,2681,https://eksisozluk.com/entry/19784395,approved
2525,288,bad,3900.0,ekşi'de yer alan içeriğin doğru ve/veya güncel olduğu hiçbir şekilde iddia veya garanti edilmemektedir.,10, Eksi Sozluk,2681,https://eksisozluk.com/entry/19784395,approved
2526,128,bad,3898.0,"kendi çerezlerimize ek olarak 3.
şahıs (“3.
parti” olarak da anılacaktır) tedarikçi ve reklam ağları, sosyal medya platformları ile diğer iş ortaklarımız, sizin ekşi’yi ve diğer internet sitelerini önceki ziyaretlerinize dayalı olarak reklam sunmak da dahil olmak üzere size daha iyi ve daha kişiselleştirilmiş hizmet sağlanması amacıyla tarayıcınıza çerez yerleştirebilirler.",70, Eksi Sozluk,2681,https://eksisozluk.com/entry/65310835,approved
2527,307,bad,3898.0,"diğer birçok internet sitesinde olduğu gibi içerik ve reklamları kişiselleştirmek, sosyal medya özellikleri sağlamak, trafiği analiz edebilmek ve internet sitemizi (kısaca “ekşi” olarak anılacaktır) nasıl kullandığınızı anlayabilmek için çerezler kullanıyoruz.",50, Eksi Sozluk,2681,https://eksisozluk.com/entry/65310835,approved
