index,case_id,classification,doc_id,quoteText,score,service,service_id,source,status
2216,220,bad,80.0,"Disqus uses, and also engages third party ad partners and affiliates who use cookie IDs, device IDs (including mobile), hashed email addresses, IP address, ISP and browser information, demographic or interest data, content viewed and actions taken on the Service or Partner Sites, including information about the websites you’ve viewed and advertisements you’ve interacted within order to provide you with more relevant advertising targeted to your preferences and interests derived from your interaction with the Service, Partner Sites or other third party websites",40, Disqus,239,https://help.disqus.com/terms-and-policies/disqus-privacy-policy,approved
2217,278,neutral,80.0,This Privacy Policy only applies to the data we collect when you use the Service or view the comments and does not apply to any website that uses the Service or other website linked to from the Service,50, Disqus,239,https://help.disqus.com/terms-and-policies/disqus-privacy-policy,approved
2218,286,bad,79.0,THE SERVICE IS PROVIDED ON AN “AS IS” AND “AS AVAILABLE” BASIS.,20, Disqus,239,https://help.disqus.com/terms-and-policies/terms-of-service,approved
2219,287,bad,79.0,"THAT THE SERVICE WILL BE AVAILABLE AT ANY PARTICULAR TIME OR LOCATION, UNINTERRUPTED, SECURE, OR ERROR FREE.",30, Disqus,239,https://help.disqus.com/terms-and-policies/terms-of-service,approved
2220,288,bad,79.0,"DO NOT WARRANT OR REPRESENT AND DISCLAIM, TO THE MAXIMUM EXTENT PERMITTED BY APPLICABLE LAW, ALL LIABILITY FOR: (I) THE COMPLETENESS.
&nbsp;ACCURACY, RELIABILITY OR CORRECTNESS OF THE SERVICES OR ANY CONTENT",10, Disqus,239,https://help.disqus.com/terms-and-policies/terms-of-service,approved
2221,128,bad,1419.0,"We do not share your information with these partners, however, in the course of serving or displaying ads through Disqus, these partners may place a cookie on your browser.
",70, Disqus,239,https://help.disqus.com/terms-and-policies/third-party-advertising-partners,approved
2222,325,bad,80.0,analytics providers such as Google based outside the EU,10, Disqus,239,https://help.disqus.com/terms-and-policies/disqus-privacy-policy,approved
2223,331,neutral,80.0,"Updated June 10, 2020</p>",50, Disqus,239,https://help.disqus.com/terms-and-policies/disqus-privacy-policy,approved
2224,336,bad,80.0,"Disqus may also send you email newsletters and email marketing messages if you have provided us with permission, or consented to receive such emails, as required in the jurisdiction in which you reside.
Email marketing messages may be tailored to your interests based on the information described above in this section,",50, Disqus,239,https://help.disqus.com/terms-and-policies/disqus-privacy-policy,approved
2225,382,bad,80.0,"We may obtain or receive personal data about you from the following parties<b>, </b>",50, Disqus,239,https://help.disqus.com/terms-and-policies/disqus-privacy-policy,approved
2226,375,neutral,80.0,"If you do not want to accept our cookies, you can adjust your browser settings to decline cookies.
You should note, however, that certain areas of the Site may not operate properly if you decide not to accept cookies.",50, Disqus,239,https://help.disqus.com/terms-and-policies/disqus-privacy-policy,approved
2227,121,bad,80.0,"Disqus may, in its sole discretion, modify or update this Privacy Policy from time to time, and so you should review this page periodically.
When we change the policy, we will update the ‘last modified’ date at the bottom of this page.
Your continued use of the Site following the posting of any changes to this policy means you accept such changes.</p>
<p>",70, Disqus,239,https://help.disqus.com/terms-and-policies/disqus-privacy-policy,approved
2228,203,bad,79.0,"We may, without prior notice to you, add or remove functionalities or features, and we may suspend or stop the Service altogether.</p>",40, Disqus,239,https://help.disqus.com/terms-and-policies/terms-of-service,approved
2229,223,good,80.0,"You may opt-out of Newsletters and promotional emails from us at any time by using the opt-out mechanism contained in such emails (also referred to as ""unsubscribe"")",10, Disqus,239,https://help.disqus.com/terms-and-policies/disqus-privacy-policy,approved
2230,243,bad,80.0,"We may seek to acquire other businesses or merge with them.
If a change happens to our business, then the new owners may use your personal data in the same way as set out in this privacy notice",50, Disqus,239,https://help.disqus.com/terms-and-policies/disqus-privacy-policy,approved
2231,323,bad,80.0,"When you use the Service, we may employ clear gifs (also known as web beacons) which are used to collect Technical Data and information such as online usage patterns.
",50, Disqus,239,https://help.disqus.com/terms-and-policies/disqus-privacy-policy,approved
2232,166,bad,80.0,"We may have to share your personal data with the parties set out below for the purposes set out in the table in paragraph 5 above.</p>
",70, Disqus,239,https://help.disqus.com/terms-and-policies/disqus-privacy-policy,approved
2233,117,bad,79.0,"YOU AGREE THAT, BY ENTERING INTO THESE TERMS, YOU ARE WAIVING THE RIGHT TO A TRIAL BY JURY OR TO PARTICIPATE IN A CLASS ACTION.</p>",50, Disqus,239,https://help.disqus.com/terms-and-policies/terms-of-service,approved
2234,148,neutral,79.0,"You are solely responsible for the activity that occurs on your account, and you must keep your account password secure.",10, Disqus,239,https://help.disqus.com/terms-and-policies/terms-of-service,approved
2235,152,neutral,80.0,The Service is not intended for use by children under the age of,15, Disqus,239,https://help.disqus.com/terms-and-policies/disqus-privacy-policy,approved
2236,187,bad,80.0,"For users based in the European Economic Area (EEA) we may share your personal data within the Disqus Group or with external third parties.
This may involve transferring your data outside the EEA.</p>",25, Disqus,239,https://help.disqus.com/terms-and-policies/disqus-privacy-policy,approved
2237,294,neutral,79.0,"<p>In the event that any provision of these Terms is held to be invalid or unenforceable, then that provision will be limited or eliminated to the minimum extent necessary, and the remaining provisions of these Terms will remain in full force and effect.",10, Disqus,239,https://help.disqus.com/terms-and-policies/terms-of-service,approved
2238,183,good,1340.0,"The entire compilation of the content found on this website is the exclusive property of DIY TUBE <strong>and</strong> content creators, with copyright authorship for this compilation held <strong>by their respective owners</strong>.
Simply stated, all content belongs to the original content creator.</p>
<p>Content creators retain all rights and ownership to their content at all times.
This includes copyright protection.</p>",50, DIY Tube Video Community,1562,https://www.diytube.info/terms-of-service/,approved
2239,299,neutral,405.0,Further information about Google’s privacy policy may be obtained from http://www.google.com/privacy.html,10, DnD5e.info,683,https://dnd5e.info/privacy-statement/,approved
2240,306,good,405.0,"e, or have left comments, you can request to receive an exported file of the personal data we hold about you, including any data you have provided to us.
You can also request that we erase any personal data we hold about you.
This does not include any data we are obliged to keep for administrative, legal, or security purposes.</p>Where we send your data<p>Visitor comments may be checked through an automated spam detection service.</p>Your contact information<p>You can use the contact form or email info@dnd5e.info.</p>Share this:<ul>
<li>Click to share on Facebook (Opens in new window)</li>
<li>Click to share on Pinterest (Opens in new window)</li>
<li>Click to share on Pocket (Opens in new window)</li>
<li>Click to share on Reddit (Opens in new window)</li>
<li>Click to share on Tumblr (Opens in new window)</li>
<li>Click to share on Twitter (Opens in new window)</li>
<li>More</li>
<li>
</li>
</ul>
<ul>
<li>Click to share on LinkedIn (Opens in new window)</li>
<li>Click to share on Skype (Opens in new window)</li>
<li>
</li>
<li>Click to share on Telegram (Opens in new window)</li>
<li>Click to share on WhatsApp (Opens in new window)</li>
<li>
</li>
<li>Click to email this to a friend (Opens in new window)</li>
<li>Click to print (Opens in new window)</li>
<li>
</li>
<li>
</li>
</ul>Like this:Like Loading...",40, DnD5e.info,683,https://dnd5e.info/privacy-statement/,approved
2241,334,good,405.0,"<p>If you upload images to the website, you should avoid uploading images with embedded location data (EXIF GPS) included.
Visitors to the website can download and extract any location data from images on the website.</p>",30, DnD5e.info,683,https://dnd5e.info/privacy-statement/,approved
2242,228,good,405.0,What personal data we collect and why we collect it,30, DnD5e.info,683,https://dnd5e.info/privacy-statement/,approved
2243,199,good,,,15, Do C's Get Degrees (discontinued?),814,https://docsgetdegrees.com/privacy/,approved
2244,408,neutral,3987.0,在你使用相关服务、使用第三方提供的内容或软件时，亦应遵从所适用之附加条款及条件。,10, Douban,2702,https://www.douban.com/about/agreement,approved
2245,201,bad,3987.0,你同意豆瓣基于其自行之考虑，因任何理由，包含但不限于缺乏使用，或豆瓣认为你已经违反本使用协议，终止你的账号或本服务之使用（或服务之任何部分），并将你在本服务内任何内容加以移除并删除。你同意依本使用协议任何规定提供之服务，无需进行事先通知即可中断或终止。,60, Douban,2702,https://www.douban.com/about/agreement,approved
2246,287,bad,3987.0,本服务将不受干扰、及时提供、安全可靠或不会出错,30, Douban,2702,https://www.douban.com/about/agreement,approved
2247,197,good,3987.0,查看历史版本,50, Douban,2702,https://www.douban.com/about/agreement,approved
2248,280,neutral,3987.0,你同意将不会利用本服务进行任何违法或不正当的活动，包括但不限于下列行为∶,10, Douban,2702,https://www.douban.com/about/agreement,approved
2249,205,neutral,3987.0,同时，如果豆瓣有理由认为你的任何行为，包括但不限于你的任何言论或其它行为违反或可能违反国家法律法规的任何规定，豆瓣可在任何时候不经任何事先通知终止向你提供服务。,15, Douban,2702,https://www.douban.com/about/agreement,approved
2250,288,bad,3987.0,使用本服务取得之结果正确可靠,10, Douban,2702,https://www.douban.com/about/agreement,approved
2251,295,neutral,3987.0,豆瓣未行使或执行本使用协议任何权利或规定，不构成对前述权利或权利之放弃。,10, Douban,2702,https://www.douban.com/about/agreement,approved
2252,144,neutral,3987.0,豆瓣公布的《社区指导原则》、《版权声明》、《豆瓣隐私政策》均是本协议的有效组成部分，本协议及与豆瓣服务相关的指引和规则（包括豆瓣单项服务指引，如：《豆瓣小站服务协议》《豆瓣原创声明》《豆瓣赞赏功能使用协议》等）共同规范你对于本服务之使用行为。,0, Douban,2702,https://www.douban.com/about/agreement,approved
2253,331,neutral,3987.0,自2019年7月7日公布。,50, Douban,2702,https://www.douban.com/about/agreement,approved
2254,228,good,3986.0,"你在使用豆瓣提供的产品与/或服务时，为了更好地实现你的目的，我们可能收集和使用你的个人信息。包括：<br>
",30, Douban,2702,https://www.douban.com/about/privacy,approved
2255,163,neutral,3987.0,本使用协议及你与豆瓣之关系，均适用中华人民共和国法律。,0, Douban,2702,https://www.douban.com/about/agreement,approved
2256,242,bad,3987.0,豆瓣将根据中国法律、本协议、《豆瓣隐私政策》的规定收集、存储、使用和透露你的个人信息。,50, Douban,2702,https://www.douban.com/about/agreement,approved
2257,185,bad,3986.0,我们会在下列情况下使用你的个人信息：,40, Douban,2702,https://www.douban.com/about/privacy,approved
2258,409,bad,3986.0,你在注册豆瓣账号时提供的信息<br> 注册并登录豆瓣账号时，需要你提供手机号码、电子邮箱或第三方账号（微信、QQ、微博 ）的信息，我们将通过发送短信验证码或邮件的方式来验证你的账号是否有效。,80, Douban,2702,https://www.douban.com/about/privacy,approved
2259,410,blocker,3987.0, 1）发布或以其他方式传送含有下列内容之一的信息：　<br> 　　· 反对宪法所确定的基本原则的；<br> 　　· 危害国家安全，泄露国家秘密，颠覆国家政权，破坏国家统一的；<br> 　　· 损害国家荣誉和利益的；<br> 　　· 煽动民族仇恨、民族歧视、破坏民族团结的；<br> 　　· 破坏国家宗教政策，宣扬邪教和封建迷信的；<br> 　　· 散布谣言，扰乱社会秩序，破坏社会稳定的；,70, Douban,2702,https://www.douban.com/about/agreement,approved
2260,411,bad,3986.0,<p>我们在中华人民共和国境内收集和产生的个人信息，将存储在中华人民共和国境内，不会存在个人信息出境之情况。,50, Douban,2702,https://www.douban.com/about/privacy,approved
2261,281,neutral,3987.0,将任何“广告信函”、“促销资料”、“垃圾邮件”、“滥发信件”、“连锁信件”、“直销”或其他任何形式的劝诱资料加以发布、发送或以其它方式传送,25, Douban,2702,https://www.douban.com/about/agreement,approved
2262,290,bad,3987.0,本服务将符合你的要求,0, Douban,2702,https://www.douban.com/about/agreement,approved
2263,294,neutral,3987.0,倘若本使用协议之任何规定因与中华人民共和国法律抵触而无效，本使用协议其他规定仍应具有完整的效力及效果。,10, Douban,2702,https://www.douban.com/about/agreement,approved
2264,383,good,3986.0,很多网络浏览器均设有 Do Not Track 功能，该功能可向网站发布 Do Not Track 请求。目前，主要互联网标准组织尚未设立相关政策来规定网站应如何应对此类请求。但如果你的浏览器启用了 Do Not Track，那么我们的网站都会尊重你的选择。,30, Douban,2702,https://www.douban.com/about/privacy,approved
2265,286,bad,1979.0,"(2) provide DL on an ""AS IS"" and ""AS AVAILABLE"" basis and any risk of using DL is assumed by you.",20, Doublelist,1891,https://doublelist.com/about/terms/,approved
2266,287,bad,1979.0,"(1) make no promises, warranties, or representations as to DL, including its completeness, accuracy, availability, timeliness, propriety, security or reliability.",30, Doublelist,1891,https://doublelist.com/about/terms/,approved
2267,202,blocker,1979.0,"DL can request that you delete, or DL may delete, any user content at any time for any reason, or no reason whatsoever.",50, Doublelist,1891,https://doublelist.com/about/terms/,approved
2268,145,bad,1979.0,"You agree to indemnify and hold DL Entities harmless from any claims, losses, liability, or expenses (including attorneys' fees) that arise from a third party and relate to your use of DL.",40, Doublelist,1891,https://doublelist.com/about/terms/,approved
2269,152,neutral,1979.0,"DL IS ONLY AVAILABLE ONLY FOR ADULTS (INDIVIDUALS AGED 18 YEARS OR OLDER).</b>
<br>
<br> NO USE BY UNDERAGE PERSONS.
NO PERSONS UNDER THE AGE OF EIGHTEEN (18) YEARS (TWENTY-ONE (21) YEARS IN PLACES WHERE EIGHTEEN (18) YEARS IS NOT THE AGE OF MAJORITY) MAY DIRECTLY OR INDIRECTLY VIEW, POSSESS OR OTHERWISE USE DL.
<br>
<br> YOU MUST BE A LEGAL ADULT.
YOU HEREBY AFFIRM AND WARRANT THAT YOU ARE CURRENTLY EIGHTEEN (18) YEARS OF AGE OR OVER (TWENTY-ONE (21) YEARS IN PLACES WHERE EIGHTEEN (18) YEARS IS NOT THE AGE OF MAJORITY) AND YOU ARE CAPABLE OF LAWFULLY ENTERING INTO AND PERFORMING ALL THE OBLIGATIONS SET FORTH IN THIS AGREEMENT.",15, Doublelist,1891,https://doublelist.com/about/terms/,approved
2270,227,good,2985.0,Personal Data for the following purposes,30, Doxy,2382,https://doxy.me/en/privacy-policy,approved
2271,199,good,2986.0,"What this means in plain English: (however, the words our lawyers use are controlling and binding):</p>
<p>These are the rules to use this site, our Terms of Service or Terms of Use (call it what you want).
Also, be sure to read our Privacy Policy to understand the details of how we use the data we may collect about you.
If you don’t like or agree to these Terms of Use and or our Privacy Policy, do not use our Site or Services.",15, Doxy,2382,https://doxy.me/en/terms-of-service/,approved
2272,128,bad,2985.0,"We use cookies and track You for various reasons that include providing a better browsing experience (for example, unique device identifiers for advertising (Google Advertiser ID or IDFA) ",70, Doxy,2382,https://doxy.me/en/privacy-policy,approved
2273,331,neutral,2986.0,<p>Last revised March 2020,50, Doxy,2382,https://doxy.me/en/terms-of-service/,approved
2274,278,neutral,1234.0,"The Site may contain links to other sites.
These links are provided for Your convenience only as references to help the User identify and locate other Internet resources that may be of interest.
Independent third parties, other than drmcdougall.com, have developed, maintain and operate these other sites and drmcdougall.com does not assume responsibility for the accuracy, completeness, appropriateness or timeliness of any statements, data, information, opinions, or advice contained at such sites.
In providing links to other sites, drmcdougall.com is in no way acting as a publisher or disseminator of the material contained on those other sites and does not monitor, or maintain any type of control, editorial or otherwise, over such sites.
A link to another site should not be construed to mean that drmcdougall.com recommends, approves or endorses, or is affiliated or associated with, that other site, or is authorized to use any trademark, service mark, trade name, logo, symbol or copyrighted work that may be reflected in the link or the description of the link to other such sites.
The User’s access to and use of such sites, whether through use of a link contained on this Site or otherwise, including the use of any material, information, products or services contained therein, are solely at the User’s own risk.</p",50, Dr. McDougall's Health & Medical Center,1521,https://www.drmcdougall.com/terms-of-service/,approved
2275,286,bad,1234.0,<p>THIS SITE AND ALL INFORMATION AND OTHER MATERIALS MADE AVAILABLE ON OR THROUGH THIS SITE ARE PROVIDED “AS IS” ,20, Dr. McDougall's Health & Medical Center,1521,https://www.drmcdougall.com/terms-of-service/,approved
2276,295,neutral,1234.0,"Any failure by drmcdougall.com to enforce any provision of this Agreement will not constitute a waiver of our right to subsequently enforce such provision or any other provision of this Agreement.
",10, Dr. McDougall's Health & Medical Center,1521,https://www.drmcdougall.com/terms-of-service/,approved
2277,163,neutral,1234.0,"The laws of California, U.S.A.
applicable therein shall govern as to the interpretation, validity and effect of this Agreement notwithstanding any conflict of laws provisions or the User’s domicile, residence, or physical location.
The User hereby consents and submits to the non-exclusive jurisdiction of the courts of California in any action or proceeding instituted under or related to this Agreement.",0, Dr. McDougall's Health & Medical Center,1521,https://www.drmcdougall.com/terms-of-service/,approved
2278,152,neutral,1234.0,"<p>To participate on this website, user should be at least 13 years of age.</p>",15, Dr. McDougall's Health & Medical Center,1521,https://www.drmcdougall.com/terms-of-service/,approved
2279,122,neutral,2252.0,"We may update this Privacy Policy from time to time.
If we do so, we will send an email to users subscribed to the Company News list.
We will also add a site banner alerting users who may not be subscribed",0, Dribbble,2069,https://dribbble.com/privacy,approved
2280,237,neutral,2253.0,"If there is any dispute between you and Dribbble about or involving the Terms, the Service, you hereby agree that the dispute will be governed by and construed in accordance with the laws of the Province of British Columbia, Canada, without regard to its conflict of law provisions.",0, Dribbble,2069,https://dribbble.com/terms,approved
2281,139,bad,2253.0,"By uploading Content or otherwise providing Content to Dribbble, you grant Dribbble the right to use (including the right to host, index, cache and format) and display your Content in connection with providing the Service as well as otherwise on the Site and our marketing communications with you and other users and prospective users of the Service, including without limitation on our emails, marketing channels and other promotional materials (subject to the requirements set out in the Privacy Policy).
To the extent we use your Content in our marketing communications, unless you expressly permit us to do otherwise, we will always cite you as the owner of such Content.",50, Dribbble,2069,https://dribbble.com/terms,approved
2282,201,bad,2253.0,<p>Dribbble reserves the right to refuse or remove any Content or terminate or deny access to your use of the Service for any reason whatsoever.,60, Dribbble,2069,https://dribbble.com/terms,approved
2283,183,good,2253.0,<p>All Content uploaded are copyright © their respective owners.</p>,50, Dribbble,2069,https://dribbble.com/terms,approved
2284,331,neutral,2252.0,"Updated October 4, 2019",50, Dribbble,2069,https://dribbble.com/privacy,approved
2285,283,neutral,2253.0,"<li>the Content is not obscene, libelous or defamatory, hateful or racially or ethnically objectionable, and does not violate the privacy or publicity rights of any third party",20, Dribbble,2069,https://dribbble.com/terms,approved
2286,163,neutral,2253.0,"British Columbia, Canada.",0, Dribbble,2069,https://dribbble.com/terms,approved
2287,243,bad,2252.0,"In the event of a change of ownership or other business transition, such as a merger, acquisition or sale of our assets, your information may be transferred in accordance with applicable privacy laws.",50, Dribbble,2069,https://dribbble.com/privacy,approved
2288,152,neutral,2252.0,"If you live in a country in the EU/EEA, you must be at least 16 years old to use our Services or such greater age required in your country to register for or use our Services.
If you live in any other country except those in the EU/EEA, you must be at least 13 years old to use our Services or such greater age required in your country to register for or use our Services.",15, Dribbble,2069,https://dribbble.com/privacy,approved
2289,150,neutral,2253.0,"Use, support or develop bots, scrapers, software, scripts, crawlers, browser plugins, robots or other automated methods including human-powered automation through like farming or any other crowd-sourced methods to access, scrape, or copy the Services, or to add or download data, or send or redirect information or messages;</li>",20, Dribbble,2069,https://dribbble.com/terms,approved
2290,122,neutral,21.0,"We may revise this Privacy Policy from time to time, and will post the most current version on our website.
If a revision meaningfully reduces your rights, we will notify you.",0, Dropbox,270,https://www.dropbox.com/privacy,approved
2291,146,bad,21.0,"Customer will indemnify, defend, and hold harmless Dropbox from and against all liabilities, damages, and costs (including settlement costs and reasonable attorneys' fees) arising out of any Claim against Dropbox and its Affiliates regarding: (a) Customer Data.
(b) Customer Domains.
or (c) Customer's, or Customer's End Users', use of the Services in violation of the Agreement.
</li>",60, Dropbox,270,https://www.dropbox.com/privacy,approved
2292,147,bad,3080.0,"The following sections will survive expiration or termination of the Agreement: 3.3 (Third Party Requests), 5 (Payment), 7 (Intellectual Property Rights), 9.2 (Effects of Termination), 9.3 (Survival), 10 (Indemnification), 11 (Disclaimers), 12 (Limitation of Liability), 13 (Disputes), and 14 (Miscellaneous).
",35, Dropbox,270,https://www.dropbox.com/privacy,approved
2293,162,neutral,404.0,Refunds are only issued if required by law.,50, Dropbox,270,https://www.dropbox.com/privacy#terms,approved
2294,227,good,404.0,"We collect and use the personal data described above in order to provide you with the Services in a reliable and secure manner.
We also collect and use personal data for our legitimate business needs.
To the extent we process your personal data for other purposes, we ask for your consent in advance or require that our partners obtain such consent.
For more information on the lawful bases for processing your data, please see our FAQ.
</p",30, Dropbox,270,https://www.dropbox.com/privacy#terms,approved
2295,195,good,21.0,"You can access, amend, download, and delete your personal information by logging into your Dropbox account and going to your account settings page.",50, Dropbox,270,https://www.dropbox.com/privacy,approved
2296,286,bad,21.0,"THE SERVICES ARE PROVIDED ""AS IS."" ",20, Dropbox,270,https://www.dropbox.com/privacy,approved
2297,197,good,21.0,You can see your previous Terms here.</p>,50, Dropbox,270,https://www.dropbox.com/privacy,approved
2298,208,bad,3079.0,"Trusted third parties include:</p>
<ul>
<li>Dropbox, Inc.</li>
<li>Amazon Web Services, Inc.</li>
<li>Teleperformance A.E.</li>
<li>Salesforce.com, LLC</li>
<li>Serenova, LLC (formerly LiveOps Cloud Platform, LLC)</li>
<li>Google LLC</li>
<li>Zendesk, Inc.</li>
<li>Oracle America, Inc.",50, Dropbox,270,https://help.dropbox.com/accounts-billing/security/privacy-policy-faq,approved
